user_href,user_timec,user_titlec,user_comment,place,price,quality,service,ambience,user_options,num_cmt_post,city,category,type_1_shop,type_2_shop
byng0k.smile,2018-02-12T18:52:00,Xôi Xéo Oanh Oanh,"Hôm nay lạnh lạnh lại thèm ăn xôi. Quán này ở ngay gần công ty nên mình đặt ship Deliverynow tầm 30' là có đồ rồi. Xôi được nấu rất dẻo, xôi xéo thì bùi bùi, thêm topping gà xào nấm hoặc pate ruốc chả là no căng. Ngoài xôi thì quán có bán cả gà ác hoặc với mỳ gà tần cũng rất đang thử. Giá cả thì phải chăng, trung bình 20-30k một suất xôi, 58k với mỳ gà tần. Quán mở cửa từ sáng đến đêm muộn, nên là ăn sáng cũng được mà ăn đêm cũng là địa diểm lý tưởng nha.",8.0,10.0,10.0,8.0,9.0,None,0,ha-noi,all,77/,45/
minhchu2287,2018-02-10T12:45:00,Xôi Xéo Oanh Oanh,"Xôi ở đây rất ngon ! Mình là người không phải thích ăn xôi cho lắm vậy mà mấy lần đặt ở đây gần như là ăn hết cả hộp :)) Hạt xôi dẻo ngon ko nhão, đỗ ăn thơm ngậy, trứng thịt kho ngon, gà xào nấm ăn cũng dc, giá dao động từ 20k-45k, mình hay đặt qua deliverynow có mã giảm giá nên nhiều khi mất có 15k/1 suất mà còn dc ship đến tận nơi :)) Ngoài ra ở đây bán cả gà tần nữa, ăn cũng khá ngon, gà thì 45k/1 suất Nói chung rất ưng quán này, sẽ tiếp tục ủng hộ",8.0,10.0,10.0,8.0,9.0,None,0,ha-noi,all,77/,45/
thanh.bui-thi-hoai,2018-02-07T08:59:00,Xôi xéo La Thành,"Buổi sáng đi làm, thứ khiến cho dạ dày chịu làm việc đến trưa chỉ có thể là xôi. Vâng, gọi một hộp xôi qua deliverynow về ăn. Cảm giác ban đầu: quán rất biết pr sản phẩm bằng cách in luôn sản phẩm lên trên nắp hộp xốp đựng xôi. Quá hoàn hảo. Tiếp theo đến chất lượng xôi. Xôi rất mềm nhưng không bị nát, không quá nhão ăn vừa miệng, không quá nhiều dầu mỡ không bị ngấy, hành khô cũng thơm, k bị cháy. Mình gọi xôi thịt kho trứng, thịt ba chỉ nhưng mỡ vẫn ăn đc:) trứng cũng ngon, lòng trắng không bị khô. Mọi thứ đều ngon phù hợp với giá mà chủ quán đưa ra. Ăn một hộp sáng hôm nay mà mai ngày kia lại muốn ăn tiếp.",8.0,10.0,10.0,8.0,9.0,None,0,ha-noi,all,77/,45/
dodieulinh,2018-02-03T10:53:00,Xôi Xéo Oanh Oanh,"Lần đầu tới quán để thưởng thức xôi ở đây. Mình đi 2 người gọi 2 xuất thường, 1 xôi chả thịt và 1 xôi chả trứng. Nhận xét về xôi thì xôi dẻo gạo thơm, đỗ mềm và ăn rất bùi, hành khô cũng thơm là loại hành khô nhà làm chứ không phải hành khô như mình vẫn thấy ở chỗ khác. Chả, trứng, thịt ăn vừa miệng rất ngậy. Điểm cộng nữa là dưa góp ở quán rất ngon ăn kèm với xôi sẽ k có cảm giác ngán. Mình gọi xuất bình thường nhưng ăn rất no ạ. Tóm lại rất ngon và nên quay lại nhiều lần !!!",8.0,10.0,10.0,8.0,9.0,None,0,ha-noi,all,77/,45/
chocolate_dangyeu_1192,2018-02-02T09:25:00,Xôi Xéo Oanh Oanh,"Xôi là thức ăn sáng nhanh, gọn, nhẹ đối với mình. Nếu một buổi sáng đau đầu không biết ăn gì thì mình sẽ chọn xôi ^^ Hôm nay mình ăn xôi xéo Oanh Oanh địa chỉ Đê La Thành- cũng là một hàng xôi có tiếng. Mình ăn xôi xéo gà xào nấm ( ruốc là bạn mình mang cho thêm vào chứ không phải mua từ quán nhé). Suất xôi trông khá đầy đặn và ngon mắt. Về xôi: xôi dẻo, thơm, đỗ ngon. 1 hộp đầy thế kia mình vẫn chén hết vì quá ngon. Về nhân: gà xào nấm nêm nêm vừa phải, không bị mặn như một vài quán khác, mỗi tội hơi ít nhân thôi ^^ Ngoài ra còn có dưa góp ăn kèm cho đỡ ngấy. Một hộp xôi như vậy là vừa vặn cho một bữa sáng ấm bụng rồi. Chăc chắn sẽ còn quay lại quán nhiều lần để thử những loại xôi khác <3",8.0,10.0,10.0,8.0,9.0,None,0,ha-noi,all,77/,45/
chihoang2108,2018-01-28T15:32:00,Xôi Xéo Oanh Oanh,"Lần cuối mình ăn là cách đây 1 tháng. Hồi trước hầu như tuần nào cũng gọi ship đến nhưng sau lần này thì mình sẽ không quay lại một thời gian. Gọi ship deli và không có thìa, hơn chục con người 9h sáng mới có cái ăn mà không có nổi cái thìa để dùng, trêu ngươi nhau quá. Không biết đây là lỗi của deli hay quán nhưng rốt cuộc thì người chịu thiệt nhất vẫn là mình. Gà lần này sụn nhiều ăn rất khó chịu. Hành phi thì cháy đen thui, ăn phải một tí thấy đắng cả miệng. Dưa góp nhạt nhẽo",8.0,10.0,10.0,8.0,9.0,None,0,ha-noi,all,77/,45/
mlinhnguyn3408,2018-01-24T21:30:00,Xôi xéo - Gà tần,"Hôm 23 vừa rồi cũng gọi là hưởng ứng U23 Việt Nam chiến thắng vào chung kết, thế là cả team rủ nhau đi ăn, đi chơi, đi đua...Đi một hồi đói quá ghé quán xôi này ăn. Mình đi 3 người gọi 2 xôi xéo gà xào nấm, 1 gà tần. Không gian quán cùng không rộng chỉ kê được một dãy bàn dài, không gian cũng khá bí vì chế biến một vài món thì đều làm ở gian chỗ cô bán hàng đứng. Mấy món rán làm người tụi mình bị ám mùi. Xôi thì thấy không ngon lắm hơi bị mặn, Gà ác tần không nếm nên không dám nhận xét hihi. Menu quán giá cũng thuộc tầm rẻ đó xôi từ 20 - 35k thì phải. Quán có một đoạn vỉa hè để xe nên cũng thấy ok.",8.0,10.0,10.0,8.0,9.0,None,0,ha-noi,all,77/,45/
Lmfaoguy,2020-10-08T10:08:00,Bà Thìn - Xôi Chè & Bánh Trôi,Gọi xôi chè hoa cúc. Ăn cũng được. Khá nóng. Ăn vào hôm trời cũng nóng thì không hợp.,7.0,7.0,7.0,7.0,7.0,None,0,ha-noi,all,23/67/,45/
piip.nguyen92,2020-02-13T15:25:00,Bà Thìn - Xôi Chè & Bánh Trôi,"1 trong những quán chè nổi tiếng ở Hà Nội Thực đơn chia làm hai mùa: mùa hè bán các loại chè đá như chè sen, Chè đỗ đen, Chè đỗ xanh... Mùa đông bán lục tào xá, bánh trôi tàu, cốm xào xôi chè... + chất lượng: món nào cũng Ok + phục vụ nhanh",6.0,6.0,9.0,8.0,6.0,None,0,ha-noi,all,23/67/,45/
vodangquy,2019-12-23T00:54:00,Bà Thìn - Xôi Chè & Bánh Trôi,"🎏Xôi chè bà Thìn - số 1 Bát Đàn Xôi mềm được cho vào chè nóng tạo nên vị đậm đà những ngày đầu thu. Ăn bùi, ngọt vừa và mình còn cảm nhận được hương thơm của đậu xanh thoảng nhẹ lên mũi.Quán nhỏ không có bàn mà kê ghế nhựa ngồi ăn vỉa hè rất đông, đặc biệt cuối tuần. Quán còn bán cả chè nước như chè sen, chè đỗ đen, chè đỗ xanh ăn cùng thạch và trân châu. 15k một bát và 30k nếu gọi cả chè nước, rất đáng để thử phải không ? Sẽ còn quay lại vào lần sau",10.0,8.0,8.0,8.0,8.0,None,0,ha-noi,all,23/67/,45/
luutrang98955534,2019-04-16T23:23:00,Bà Thìn - Xôi Chè & Bánh Trôi,"Một trong những món phải thử nhất khi đến Hà Nội - xôi chè. Mà với t phải là của bà Thìn, phải là xôi vò của bà Thìn cơ :(( Ăn rồi mà cứ thèm mãi, đúng là món ngon ""đinh"" của phố cổ, đỉnh của mùa thu Hà Nội❤️ . Bà Thìn bán đủ các loại chè truyền thống, như xôi chè, chè kho, chè hạt sen, chè đỗ đen, bánh trôi tàu, cốm xào... giá 15-25k/b. Nên thử nhất ở đây vẫn là xôi chè hoa cau, xôi chè bà cốt và tào phớ thạch trân châu mn nhé👍🏻Xôi của bà ngon vì cái dẻo thơm, hạt mẩy vàng óng mà rất tơi. Quyện cùng với chè hoa cau ngọt thanh, hay với chè bà cốt nóng sánh mịn, ngọt đậm hơn và thoảng vị cay nhẹ của gừng. Ăn xong mà cứ xuýt xoa vì ngon :(( Nếu mn sợ ngọt quá thì nên gọi nhiều xôi ít chè nhé :""> Mà thử gọi xôi cục nữa ăn thích lắm đó👏🏻 . Ngồi một góc phố cổ, tám chuyện với bạn bè, trên tay là bát xôi nóng và bát tào phớ thơm mùi hoa nhài. Mùa thu Hà Nội đây❤️ . 🕑7h30-23h",8.0,8.0,10.0,8.0,7.0,None,0,ha-noi,all,23/67/,45/
viet_trader102,2019-02-15T18:06:00,Bà Thìn - Xôi Chè & Bánh Trôi,"Vẫn ngon như cơ sở 1. Mỗi tội ngồi vỉa hè bẩn, mùi cống kinh quá",3.0,7.0,7.0,3.0,2.0,Có thể,0,ha-noi,all,23/67/,45/
viet_trader102,2019-01-02T19:56:00,Chuẩn vị Hà Nội,"Xôi chè bà Thìn mấy chục năm nay có tiếng, đủ những vị chè truyền thống cả mùa nóng và lạnh. Nhất là xôi chè bà cốt, chè hoa cau trong đêm đông giá buốt. Chè bà Thìn ko quá ngọt, xôi dẻo, ngầy ngậy, để lâu vẫn dẻo săn hạt. Giá cả vừa phải.",7.0,7.0,10.0,2.0,5.0,Chắc chắn,0,ha-noi,all,23/67/,45/
01266660901,2018-11-12T14:29:00,Bà Thìn - Xôi Chè & Bánh Trôi,"Chiếc gió thu🍂 đã thực sự ùa về trên phố phường Hà Nội rồi các ông ạ. Cái mùa gì mà đẹp mà yêu vô cùng, đi xa là nhớ gặp nhau là mừng 😘 Lang thang phố cổ chiều thu thèm bát chè nóng ấm cổ họng là nhớ ngay ra quán ở bát đàn. Thực ra mình hay ngồi góc H.Bồ hơn vì có chỗ ngồi trong nhà rộng rãi, không phải ngồi vỉa hè chật chội bên kia, 2 nhà cách nhau 1 tí đường cùng chủ nha. Xôi chè bà cốt ở đây gây nghiện cực kỳ, chè thơm mùi gừng ấm nóng, không ngọt sắc mà vẫn đủ đậm đà, ăn cùng xôi vò đậu xanh đúng ngon luôn í 😛 Mấy hôm thay đổi thời tiết khụt khịt mà ăn xong bát chè thấy nhẹ cả người, món này với bánh trôi tàu là chuẩn bộ đôi nè. Ngoài ra có thể chọn ăn xôi với chè đậu xanh hoa cau hoặc đậu đen đều ok. Các đồ mùa hè vẫn bán bình thường không như đồ mùa đông thì phải vào hẳn mùa lạnh cô mới làm nên là bị hụt hẫng lắm😂 Qua hơi muộn xíu còn hết cả mấy món bánh ăn chơi rồi cốm xào, chè con ong tiếc ghê lắm, nhớ qua sớm 1 chút thì đủ món lựa chọn hơn nha các bồ",8.0,8.0,9.0,8.0,8.0,None,0,ha-noi,all,23/67/,45/
cuathithanh,2018-10-18T18:49:00,Chè ở đây bán lâu năm lắm rồi và cũng ngon nổi tiếng rồi ah,Chè ở đây bán lâu năm lắm rồi và cũng ngon nổi tiếng rồi ah,6.0,7.0,10.0,8.0,8.0,None,0,ha-noi,all,23/67/,45/
decem.21st,2018-10-17T18:02:00,"Thơm,mịn và có chất riêng","Mình ăn ở đây 2 lần,cũng nghe danh từ lâu bh mới được thưởng thức.Xôi chè ở đây mịn,thơm và rất nóng hổi nữa nhé,k bị ngọt quá như những quán khác.Món mình thích nhất ở đây là xôi chè bà cốt,còn xôi chè hoa cau mình ăn thấy bình thường....Nói chung là món xôi chè Bà Thìn thì nổi tiếng phố cổ vì đậm chất xưa và hương vị HN.Nên thử !",10.0,10.0,8.0,10.0,10.0,Chắc chắn,0,ha-noi,all,23/67/,45/
phmlinhchi,2018-10-09T15:40:00,Cũng ngon,"Lâu lâu đổi gió ăn xôi chè nhưng thực sự ăn xong là cổ họng ngọt quá đáng ko thể ăn thêm gì nữa😂 Mình ăn cốt và thực sự nó rất ngọt. Bạn mình gọi vị bớt ngọt hơn( mình quên tên) nhưng nó cũng khá ngọt. Xôi mềm, thơm, duy chỉ có là ngọt thôi. Cũng đáng để mn ăn thử! Có vẻ như mn đều hảo ngọt nên ai đến mình cũng thấy gọi cốt à. Nếu đến quán nữa thì mình chỉ ăn chè thôi",7.0,8.0,8.0,8.0,5.0,None,0,ha-noi,all,23/67/,45/
hongha2611,2018-08-16T08:36:00,Bad service!!!,"Mình đi cùng bạn người nước ngoài nên chọn món hơi lâu, thái độ phục vụ của bạn nam béo rất ko tốt, bạn mình sợ quá đành chọn đại, lúc đưa cốc chè cho bạn mình cảm giác như ném cả cốc vào mặt. Giá cao hơn một vài nơi mà chè hay tào phớ cũng bình thường ngưng thái độ phục vụ thì quá tệ",3.0,2.0,2.0,1.0,2.0,None,0,ha-noi,all,23/67/,45/
Paula_Phuong,2018-07-31T17:50:00,Xôi chè ngon tuyệt :),"Chè cô này nấu ngon lắm nhé, ko quá ngọt. Mình thích món xôi chè nhất vì hương bị rất hà nội. Cô chủ lớn tuổi và thân thiện và dễ thương. Mình là fan chè nên đã ăn rất nhiều chỗ ở hà nội, mình thích chỗ này nhất. Mấy chỗ khác nấu ko ngon, quá nhiều hương liệu, quá ngọt và buồn đời nhất là khách hàng hỏi, bà chủ ko thèm trả lời :( kiểu như tự đọc menu đi cô gái. Bạn nào sài gòn ra nhớ đến thử chè ở đây nhé. Trái tim, trái tim...",6.0,9.0,9.0,9.0,6.0,None,0,ha-noi,all,23/67/,45/
Nhatvan_n,2018-06-26T21:51:00,Bà Thìn - Xôi Chè & Bánh Trôi,"Thái độ phục vụ quá tệ. Mình từ Nam ra, chè mặc dù cũng ok nhưng đã mắc còn phục vụ hách dịch. Mình gọi nhầm chè nhưng vẫn nhận và bù tiền cho chị chủ nhưng thái độ bán hàng như bố thí thì quá kém",4.0,1.0,3.0,1.0,1.0,Không,0,ha-noi,all,23/67/,45/
Khanhl0ng279,2018-04-01T22:59:00,Chè xưa hà nội,"Chuyên các loại chè cổ hà nội xưa , ai đến thủ đô muốn tìm hiểu các loại chè xưa hà nội đến đây coi như có đầy đủ nhé, còn chè bà thìn chưa phải hàng ngon nhất nhì hà nội đâu nhé",7.0,8.0,8.0,8.0,6.0,Có thể,0,ha-noi,all,23/67/,45/
viet.dreamer0711,2018-03-24T20:24:00,Bà Thìn - Xôi Chè & Bánh Trôi,"Nghe danh đã lâu mà mãi đến đợt vừa rồi mới có dịp đên ăn tại quán. Cơ sở này của quán có tận 2 quán đối diện nhau, làm mình cứ sợ vào nhầm hàng fake 😂 Quán mình đến vào buổi tối đông khách lắm, mình suýt nữa thì không có chỗ mà ngồi. Tuy đông nhưng bác lên đồ lại rất nhanh, mình có gọi một bánh trôi tàu và bạn mình gọi xôi chè. Bánh trôi mình thấy ăn đúng vị kiểu ngày xưa, ko biến tấu nhiều như các quán khác, bánh trôi này ko ngọt lắm, thơm vị dừa và lạc. Bánh ăn dẻo, nhân đỗ và vừng đen đều ngon. Về xôi chè mình thấy rất ngon, chè ăn thơm và ngọt vừa, xôi dẻo ăn rát thích. Có dịp lên phố mình nhất định sẽ quay lại quán.",7.0,8.0,8.0,8.0,6.0,None,0,ha-noi,all,23/67/,45/
girlxinh_thayboy_ladanh,2018-03-14T16:43:00,Bà Thìn - Xôi Chè & Bánh Trôi,"Xôi chè tuổi thơ gắn liền với mình. Phục vụ nhanh nhẹn Xôi thơm, đa dạng nhiều loại để chọn theo sở thích mỗi người Quán hầu như là ngồi ngoài đường nên khá thoải mái. 15-20k/bát",6.0,8.0,8.0,6.0,9.0,None,0,ha-noi,all,23/67/,45/
miyuki4081995,2018-02-24T18:45:00,Bà Thìn - Xôi Chè & Bánh Trôi,Đây là món tình yêu mùa đông của tôi từ năm ngoái đến đông năm nay lại tiếp tục đi với người eo. Phải đủ combo chè đỗ đen xôi vò ở đây với chago rồi dắt nhau lên phố đi bộ mới chịu được. Thích ăn chè đỗ đen lắm vì nó được minh nhừ nhưng không quá nhuyễn vẫn giữ được nguyên hạt nhưng lại tan ngay trong miênhj ăn cùng với xôi vò nhiều đỗ xanh thì đủ sự ngọt ngào cho ngày đông lạnh giá rồi.,8.0,7.0,9.0,7.0,7.0,None,0,ha-noi,all,23/67/,45/
,2018-01-10T15:45:00,Món ngon mùa đông,"Đây là lần đầu mình ăn xôi chè bà Thìn, căn bản do mình ko hảo ngọt nên ko mấy khi đi ăn các món này! Mình gọi 3 bát: bánh trôi tàu, xôi chè đỗ đen và xôi chè mật, ấn tương chung là thơm ngon, ngọt hơi đậm so với vị mình, thơm mùi gừng nên cảm giác ấm bụng, thích nhất là xôi vò ăn kèm, dẻo thơm, hạt xoi tơi đều... Phục vụ siêu nhanh, anh nhân viên đứng ngay ngoài ý, mình chưa kịp ngồi thì ông ý đã hỏi tới hỏi tấp ăn gì rồi mang đồ ra ngay jui, món ăn tao nhã nhưng cái không khí ăn như hỏa tốc ý..ko thích lắm!",7.0,7.0,8.0,6.0,6.0,None,0,ha-noi,all,23/67/,45/
xuancuong529,2017-12-17T20:25:00,Chè bà thìn,"Chiều rảnh đi ăn cốc chè cho đỡ háo, đến chè bà thìn ở hàng bồ, chè ngon, quán đông nhưng phục vụ nhanh",7.0,7.0,7.0,7.0,7.0,None,0,ha-noi,all,23/67/,45/
huongmai1899,2017-11-16T01:51:00,Bánh trôi tàu,"• Không gian: hơi chật và thiếu ánh sáng. Quán rất đông khách nhưng gian nhà hơi nhỏ một chút, nếu ngồi vào mùa đông sẽ rất ấm cúng. Nhưng vẫn đủ thoải mái, không bất tiện cho người đến ăn. • Đồ ăn: đây là lần đầu mình ăn thử bánh trôi tàu nên không thể so sánh với chỗ khác được. Bánh nóng hổi và mềm dẻo, ăn trôi tuột vào trong bụng. Có 2 loại nhân: nhân mè đen và nhân đậu xanh. Cá nhân mình thấy đậu xanh dễ ăn hơn. Bánh trôi tàu tương đối ngọt nên mình ăn hết 1 cái đã khá ngấy. 1 bát 2 cái là vừa đủ độ. Ăn xong bát bánh trôi tàu nóng thì nên ăn thêm cốc chè mùa hè nào đó lành lạnh, sẽ thấy rất sảng khoái.",6.0,7.0,7.0,8.0,6.0,None,0,ha-noi,all,23/67/,45/
nguyentruongtung95,2017-11-06T18:27:00,Thái độ phục vụ k tốt,"Mình k thích thái độ phục vụ hôm nay, thực sự về nhà mệt nên mua ăn cho thoải mái nhưng cứ nghĩ đến vẻ mặt lầm lì, k hiếu khách mình lại chán k muốn ăn",7.0,8.0,8.0,1.0,5.0,None,0,ha-noi,all,23/67/,45/
lubchngc,2017-10-29T21:44:00,Bà Thìn - Xôi Chè & Bánh Trôi,"Cả mùa mới quay lại Bà Thìn ăn. Lần thứ 2 mình ngồi bên cơ sở này của Bà Thìn. Công nhậnlaf cùng 1 nhà nhưng bên này làm k ngon bằng bên số 1 Bát Đàn ạ. Trân châu trắng có nhân dừa bên trong thì vẫn ngon. Chè sen thì bị sen hơi vụn. Ăn hơi ngọt quá. Chè đỗ đen bùi, ngọt, ăn cũng hơi ngọt quá. Nhìn chung chè ở đây vẫn là ngon. Mỗi cốc chỉ có 20k thôi. Giá cả dễ chịu. Bên này ngồi ở trong nhà, mát mẻ, sạch sẽ. Phục vụ ổn. Bà ngồi múc chè mặt hơi khó chịu nhưng đi ăn trên phố thì cứ đanh mặt lại là người bán tự phải hạ giọng đi thôi 😂",8.0,8.0,8.0,7.0,8.0,None,0,ha-noi,all,23/67/,45/
poohdang97,2017-08-15T03:47:00,[Chuyện đi ăn xôi chè bà Thìn - đúng là bà Thìn Việt Nam 😡],"Chuyện bắt đầu khi sáng nay mình cùng 4 bạn nước ngoài cùng nhau đi ăn sáng. Mình dùng Foody thấy ở gần đấy có một quán xôi chè, nghĩ là đặc biệt với các bạn nên mình dẫn các bạn đến đó. Quán tên là ""Xôi chè bà Thìn"". (Mình không biết bà bán hàng có phải bà Thìn hay không nhưng dưới đây mình sẽ tạm gọi là bà Thìn). Một ngày nọ, bà Thìn đang ngồi cau có vì sáng ngày ra vẫn chưa có khách. Mình dẫn các bạn (tổng cộng 5 người) đi đến, những tưởng bà Thìn sẽ vui mừng ra mặt vì vớ được một đám khách, không ngờ bà Thìn vẫn cau có, mình lúc đó vẫn chưa hiểu tại sao, tưởng bà Thìn thất tình nên kệ bả. Mình còn đang phải giải thích cho các bạn những cái này là cái gì, thì mình nghe thấy tiếng bà Thìn: - Chúng nó không ăn đâu! Đi đi! Mình trợn tròn mắt kinh ngạc, nhưng liếc nhìn thì thấy các bạn vẫn đang tập trung vào mấy thứ chè bên dưới không ngẩng lên nên cũng không thấy được thái độ của bả. Mình không muốn để các bạn biết nên phớt lờ chuyện vừa rồi và tiếp tục nói với các bạn, bên tai vẫn nghe thấy những tiếng làu bàu ""Đi đi"", ""Mất thời gian"", ""Sáng ngày ra"", bà nói không to nhưng thể hiện rõ sự học hằn của bả. Mình vẫn giữ sự phớt lờ. Đỉnh cao là khi mình ngẩng lên còn thấy bà Thìn cau mặt quay sang bà chị bưng bê thể hiện sự khó chịu của bả thì bà chị đấy cũng quay ra bọn mình và nói ""Đi đi"" cùng với động tác xua tay!? Đến đây thì mình quá kinh ngạc luôn. Ở đâu ra cái kiểu đuổi khách lại còn lấy tay xua? Quan trọng là các bạn có thể thông qua động tác xua tay đó mà hiểu rằng đang có vấn đề. Mình đã rất tức giận, không biết các bạn có nhìn thấy hay không hay vẫn mải thảo luận mấy món chè, chỉ biết là không thấy hỏi mình kiểu như ""Có chuyện gì thế?"" ""Tại sao?"" nên mình đoán các bạn không biết. Lẽ ra mình đã có thể tức giận dẫn các bạn bỏ đi nhưng thứ nhất, nếu đi sẽ phải giải thích với các bạn chuyện vừa rồi mà mình không mong các bạn biết điều đó, thứ hai, nếu đi thật thì chắc chắn rằng bà Thìn sẽ chửi sau lưng bọn mình, và mình không muốn mọi thứ theo đúng ý bà ấy rằng ""Chúng nó không ăn đâu"", theo đúng cấu trúc: đoán là khách không mua - đuổi khách - khách đi thật - chửi khách vì khách không mua, một cấu trúc sao mà ngu đến thế! Thế là sau khi các bạn đồng ý, bọn mình vào ngồi, nhưng hai bà kia hoàn toàn không care, nhất loạt quay mặt ra đường, mình không hiểu tại sao, chỉ bắt đầu lúng túng ái ngại. May mà các bạn vẫn chưa biết chuyện gì xảy ra, bảo mình đi lấy hộ vì không biết mix như nào, cái nào ngon, không thì mình vẫn đang chưa biết phải làm gì tiếp theo. (Đọc tiếp ở cmt)",8.0,8.0,8.0,7.0,8.0,Không,1,ha-noi,all,23/67/,45/
lubchngc,2017-06-23T14:36:00,"Xôi, Chè & Bánh Trôi","🌸 Chè Bà Thìn làm ăn tốt ghê. Mới mửo thêm cơ sở 2 ở ngay cạnh, chỗ 95 Hàng Bồ nè 😍. Mình thì mình vẫn thích ngồi vỉa hè như hàng cũ hơn nhưng hôm đó đi ăn do năng nóng quá nên mới sang đây, cũng tiện check quán mới luôn 😅 🌸 Cơ sở này chất lượng vẫn đồng đều như bên kia, chè vẫn ngon và đúng vị. Mình ăn sen trân châu và đen thạch trân châu. Món nào cũng ngon, đặc biệt là chè đỗ đen của Bà Thìn là ngon nhất, k chỗ nào sánh được luôn í. Đỗ luôn được nấu vừa tới, độ ngọt vừa phải, trân châu ngon, ăn sướng mê 😍 🌸 Mà chắc do bên này mới nên nhân viên chưa biết ước lượng độ cho vào như bên kia nên 2 cốc của mình lại đầy ụ cả đỗ, cả sen lẫn trân châu, thạch 😅. Kể ra thì là lợi nhưng nhiều quá nên ăn cũng bị ngấy 😅 🌸 Nhân viên k thân thiện như bên kia nhưng phục vụ nhanh. Chè thì có 16k 1 cốc, tăng chút giá so với hồi trước 😅",8.0,8.0,9.0,7.0,8.0,None,0,ha-noi,all,23/67/,45/
thuhuyen_133,2017-06-23T11:15:00,"Xôi, Chè & Bánh Trôi","Đây cũng được gọi là xôi chè bà Thìn nha, cách hàng số 1 Bát Đàn có mấy nhà thui.Nghe nói là 2 chị em, con bà thìn được mẹ truyền nghề. 2 bên bán hàng giống hệt nhau luôn, giá cả cũng như nhau. Bên này được cái có chỗ trong nhà ngoài thoải mái, rộng rãi hơn, bên kia chỉ ngồi vỉa hè thôi. Nhưng không hiểu sao mình thấy bên kia nổi và đông hơn. Vị chè thì cũng giống nhau. Mùa đông thì có xôi chè nóng và cả bánh trôi tàu. Xôi chè có chè đỗ đen, chè đỗ xanh với chè bà cốt. Chè bà cốt ăn có vị gừng hơi giống bánh trôi tàu. Cá nhân mình thì thích ăn xôi chè đỗ xanh hơn. Mùa hè cũng có xôi chè nha, chè mùa hè là chè hoa cau ăn thơm ngon. Các loại chè nước, tào phớ, trôi, thạch đen của quán cũng khá ngon. Đồng giá chè 15k, nếu ăn thêm hạt sen thì là 20k Bánh chín tầng mây ở đây cũng ngon, ăn vị nhẹ nhẹ ít ngọt, mùi thơm thơm, ăn dai dai cũng vui miệng.",7.0,9.0,8.0,7.0,8.0,Chắc chắn,0,ha-noi,all,23/67/,45/
